{
  "schemaVersion": 2,
  "apiVersion": "^1.0.0",
  "id": "acme.web-dev-pack",
  "name": "Web Dev Pack",
  "version": "1.0.0",
  "publisher": "acme",
  "permissions": {},
  "marketplace": {
    "description": "Three extensions for web work.",
    "license": "MIT"
  },
  "extensionPack": [
    "acme.hello",
    "acme.lint-guard",
    "acme.notes"
  ]
}
